{"attempt_id":"05faeaf6-d2c8-54bb-a481-e4a86254e9ac","contract_version":"dev-dispatch.attempt-context/v1","findings":[{"location":"src/fleet_graph/graphs/dd_runner.py:386 (with dd_pipeline.py:346-348 and data_plane.py:378-392)","severity":"major","summary":"The exposition is rendered exactly once, after `compiled.invoke` returns, so a generation killed before it returns leaves no `cost-obs-<development>.prom` for the next generation to rehydrate -- and the replayed generation then publishes a settled order with no launch series and no explicit-missing series either."},{"location":"tests/test_dd_runner.py:562","severity":"minor","summary":"`test_generation_two_rehydrates_the_previous_scrape_file` does not discriminate the fix it names: the prior generation's state root is never created, so the installed ReceiptReplayer declines every stage and the implement/review actors run for real, re-emitting launch and both reviews. The three assertions (launch sum 1.0, review sum 2.0, reconciliation 1.0) hold identically with `dd_runner.py:357` deleted, so the regression guard for the previously-blocking defect would not fail if that defect were reintroduced."},{"location":"src/fleet_graph/graphs/dd_scripts.py:301","severity":"note","summary":"`MergeStage` emits `cost_obs_promotion_total{via=\"merge\"}` unconditionally, including when `publish` is false and the stage result is `PREPARED` rather than `MERGED`, so `sum(cost_obs_promotion_total)` counts prepared-but-unpublished merges as promotions."}],"implementation_subject_commit":"6ecfc05528e754c5b6228ed8f49e62705be8c642","review_id":"rf-05faeaf6-d2c8-54bb-a481-e4a86254e9ac","review_phase":"final","reviewer_job_id":"05faeaf6-d2c8-54bb-a481-e4a86254e9ac","reviewer_model":"claude-opus-5[1m]","spec_digest":"sha256:babc327cc702279ca67d7d83db24dbb29e1ddc25cede609c649869b671863e62","subject_commit":"30d3768bf4b822d1f3c7405df9668053a5d2a5ac","verdict":"APPROVE"}
