{"attempt_id":"c6e94cea-bf02-577e-8770-98a34f3a40ca","contract_version":"dev-dispatch.attempt-context/v1","findings":[],"implementation_subject_commit":"c2475c5e1b3b500bd12db66f4472e154abb442b6","review_id":"rf-c6e94cea-bf02-577e-8770-98a34f3a40ca","review_phase":"final","reviewer_job_id":"c6e94cea-bf02-577e-8770-98a34f3a40ca","reviewer_model":"claude-opus-5[1m]","spec_digest":"sha256:9158c84a4aec330daba590424897d72927fa7fc964241ba1bb4ad6107e18bff9","subject_commit":"47afe01bdc1f5f4cabf9e7ad28a80f5614172b53","verdict":"APPROVE"}
