{"attempt_id":"7830819a-507a-5f50-b950-c962e8039920","contract_version":"dev-dispatch.attempt-context/v1","findings":[],"implementation_subject_commit":"91df0e5993d63c46983607b1d6325ce20bc52876","review_id":"rc-7830819a-507a-5f50-b950-c962e8039920","review_phase":"continuous","reviewer_job_id":"7830819a-507a-5f50-b950-c962e8039920","reviewer_model":"gateway/deepseek-v4-pro","spec_digest":"sha256:06b090384300eb9bd2ac800db93b48ac6f3761ce307c25de425e679e829c10f6","subject_commit":"91df0e5993d63c46983607b1d6325ce20bc52876","verdict":"APPROVE"}
