{"attempt_id":"92922574-a7d0-57a4-8f03-3cfc52ccf437","contract_version":"dev-dispatch.attempt-context/v1","findings":[],"implementation_subject_commit":"8b044d4c6d22307a91c9eaceb1fdc2b3d7833f80","review_id":"rc-92922574-a7d0-57a4-8f03-3cfc52ccf437","review_phase":"continuous","reviewer_job_id":"92922574-a7d0-57a4-8f03-3cfc52ccf437","reviewer_model":"gateway/deepseek-v4-pro","spec_digest":"sha256:91fe728ad7df53f6a863b123f8d68dc78ec77596cbdde35dd4d2385424c9757a","subject_commit":"8b044d4c6d22307a91c9eaceb1fdc2b3d7833f80","verdict":"APPROVE"}
