{"attempt_id":"e163a578-5c19-5b22-ae01-42ae523b5781","contract_version":"dev-dispatch.attempt-context/v1","findings":[],"implementation_subject_commit":"4504cc270cae2497beea737f4f75dd5d98b36cfe","review_id":"rf-e163a578-5c19-5b22-ae01-42ae523b5781","review_phase":"final","reviewer_job_id":"e163a578-5c19-5b22-ae01-42ae523b5781","reviewer_model":"gateway/deepseek-v4-pro","spec_digest":"sha256:0b38a7b26b1b7c14ce1b9b008d50be7c79d88d7a04106b46eaff2afb32120f2b","subject_commit":"0ad3225ef7cb1db7ba66d440512a39860cbc214d","verdict":"APPROVE"}
