{"attempt_id":"attempt_01M10SZK9H105C8B2FX242Q9EY","contract_version":"dev-dispatch.attempt-context/v1","findings":[{"severity":"blocker","summary":"unmet mandatory requirement R8: The seal-verified Implement verification record lists the four frozen commands with exit_code 0 and pass counts but preserves neither cwd nor stdout nor stderr, so the Frozen Acceptance requirement of complete stdout, stderr, exit status, and cwd preserved in the acceptance receipt is not satisfied by the authoritative record."},{"severity":"blocker","summary":"unmet mandatory requirement R9: The verified verification record contains no independent live PumpDown alert-state query confirming the original eleven false positives are absent and the monitoring semantics remain observable, so the post-candidate Frozen Acceptance confirmation step is missing from the handoff evidence."}],"implementation_subject_commit":"a4abb756fd4aafb97a27d78a6ea15b1880297c72","review_id":"rc-attempt_01M10SZK9H105C8B2FX242Q9EY","review_phase":"continuous","reviewer_job_id":"lemcp-v1:dev_fleet_pumpdown_roster_systemd_correctness_20260827_01:continuous_review:attempt_01M10SZK9H105C8B2FX242Q9EY","reviewer_model":"deepseek-v4-pro@opencode/chain","spec_digest":"sha256:0107b1f0ebd8412843d665ecf9cfd2835b8cd7ffdec757c2b82f26cf00edbf81","subject_commit":"a4abb756fd4aafb97a27d78a6ea15b1880297c72","verdict":"REJECT"}
