{"attempt_id":"bdaa05b5-9b04-57aa-9f61-d0c797666dce","contract_version":"dev-dispatch.attempt-context/v1","findings":[],"implementation_subject_commit":"d3b0e982cb24399e428a4fbd364e9071d93d9db2","review_id":"rc-bdaa05b5-9b04-57aa-9f61-d0c797666dce","review_phase":"continuous","reviewer_job_id":"bdaa05b5-9b04-57aa-9f61-d0c797666dce","reviewer_model":"gateway/deepseek-v4-pro","spec_digest":"sha256:f58fc1da5c95c307aba347798ce46e427c9394399060cc9fd2066726974137ee","subject_commit":"d3b0e982cb24399e428a4fbd364e9071d93d9db2","verdict":"APPROVE"}
