{"attempt_id":"73d1dfb6-1b25-5469-87b1-a351e99b6bc6","contract_version":"dev-dispatch.attempt-context/v1","findings":[{"location":"delivery.md:43-63","severity":"major","summary":"delivery.md 未提供本次交付的准确产品身份。文档仍声明产品候选 HEAD 为 0d08b861f6608b82c6d812b726c67a3c9ae4cc27、输入 commit 为 68c1ff9d22f7f5c998d20e328c24059206b5737b，并声称后续只增加 delivery.md；但本次 implementation_subject_commit 是 b842d55a6a8bb10dfe20d48dd6ccaac5cf0442ee，绑定 worktree HEAD/subject_commit 是 fe2de6ad6179145226a85b54691bde21ef00dfb5，且当前产品树包含后续实现变更。由此违反 SPEC 对 delivery.md 附精确 HEAD、输入身份及需求到实现到测试映射的要求。"}],"implementation_subject_commit":"b842d55a6a8bb10dfe20d48dd6ccaac5cf0442ee","review_id":"rf-73d1dfb6-1b25-5469-87b1-a351e99b6bc6","review_phase":"final","reviewer_job_id":"73d1dfb6-1b25-5469-87b1-a351e99b6bc6","reviewer_model":"gateway/gpt-6-astra","spec_digest":"sha256:9d3ebdd69dddb9306f9dc42084441c26cd4db5c904d35cea20178a0972a8c267","subject_commit":"fe2de6ad6179145226a85b54691bde21ef00dfb5","verdict":"REJECT"}
