{"attempt_id":"9513d2e4-ffc2-58b2-a2fa-292f93b4ec83","contract_version":"dev-dispatch.attempt-context/v1","findings":[],"implementation_subject_commit":"6d673ea0bb784a69aeca2c9deb895265a5a65106","review_id":"rf-9513d2e4-ffc2-58b2-a2fa-292f93b4ec83","review_phase":"final","reviewer_job_id":"9513d2e4-ffc2-58b2-a2fa-292f93b4ec83","reviewer_model":"claude-opus-5[1m]","spec_digest":"sha256:d4ad9a197b5a0c12d206ec26ea09d215746a207316811fa3adc5b236416acc56","subject_commit":"29050c4f1c5f6295c4151a3f17106614966c163f","verdict":"APPROVE"}
