{"attempt_id":"33ef469d-f44e-58e0-b3fb-e81ac9a1ae97","contract_version":"dev-dispatch.attempt-context/v1","findings":[{"location":"src/fleet_graph/goal/request_kernel.py:731-806,857-886,995-998; tests/test_goal_request_kernel.py:457-486,1679-1824,2441-2505","severity":"major","summary":"blocked 状态下的请求接受与唤醒不能作为一个逻辑操作恢复。submit 先持久化 RECORD_REQUEST，再单独写入 running 模式；若在两者之间中断，restore 虽恢复请求队列，却不根据该请求事件恢复唤醒，仍保留 blocked。重投同一请求又在 duplicate 分支直接返回，不补全唤醒，因此调用方可以收到重复接受确认，而 next_goal_call 持续拒绝处理该请求，直到另一个新请求或显式 resume 到来。应按日志顺序恢复请求导致的 blocked/waiting 唤醒，同时保持 stopped 不被请求解除，并增加请求写入后、模式写入前中断及同身份重投的隔离回归。现有正常唤醒、并发接受和 ACK 前入队测试未覆盖该窗口。这违反行为 5、7 和 P6。"},{"location":"src/fleet_graph/graphs/kernel_coordinator.py:480-500; src/fleet_graph/graphs/dd_gate.py:312-327; tests/test_goal_request_kernel.py:2542-2649","severity":"major","summary":"下游 gate 原始回执保留修复只覆盖成功分支。KernelEffectPorts._gate 仅在 status=consumed 时复制回执字段，其余返回值仍通过 _failed 缩减为 status/detail。例如 GraphGateNode 的 gate_obligations_failed 回执包含 development_id、结构化 reason 和逐项 evidence，经过该适配器后这些字段全部丢失，kernel journal 及重建后的分页无法查询真实失败结果与证据。应在成功和失败路径统一保留原始下游回执，再独立提供标准化 delivery 状态；增加真实 KernelEffectPorts 配合 fake gate 返回失败证据的持久化及重建测试。当前新增回归仅返回 consumed。这仍违反行为 6，而非要求延期的真实 Runtime 验证。"},{"severity":"note","summary":"git_identity 已确认绑定 worktree 根目录为 /data/code/fleet-comparison/self/wf-2bf703-fleet-graph-dd01，实际 HEAD 与 input_commit、subject_commit 均为 e41e6b85088beaa1c310b9a6e56c43c8ab91d3aa。git_product_diff 使用指定完整 I/RC 身份，排除 .dev-dispatch 后返回 exit_code=0，机械证明产品树一致。未因两个 SHA 不同提出发现；本轮未执行写操作。"},{"location":".dev-dispatch/feedback/index.json; .dev-dispatch/feedback/history.json; src/fleet_graph/graphs/goal_line.py:1033-1052","severity":"note","summary":"已读取批准 SPEC、当前反馈索引、不可变历史归档及其引用的全部审查文件，并独立检查 kernel、产品组合入口、DD/gate 适配器和相关测试。当前 Continuous 为 APPROVE，不替代本次 Final 判断。上一轮 ACK 后丢失请求的问题已通过 persist 回调在 ACK 前调用 enqueue_requests 修复；成功 DD/gate 返回值的状态和证据保留也已实现，本次仅指出失败 gate 分支仍遗漏。"},{"location":".dev-dispatch/handoffs/33ef469d-f44e-58e0-b3fb-e81ac9a1ae97/implement.json; .dev-dispatch/spec/approved.md","severity":"note","summary":"当前 implement.json 记录 .venv/bin/python -m compileall -q src 退出 0，以及 .venv/bin/python -m pytest -q tests/test_goal_request_kernel.py 84 passed、退出 0。这些是实现阶段提供的结果，本 reviewer 未执行测试；该记录未提供 SPEC 要求的 cwd、时间及 stdout/stderr，actor work_head_commit 为 0abb7caee51e3295103b08fe420c6bd2a9574751，应与封存 I 身份区分。真实 Runtime 调用、实际 reply 投递、真实进程 stop/resume 与恢复、完整 Session 查询、集成、部署及联合 E2E 本轮均未运行，按开发阶段约束延期；延期不是拒绝理由，也不声明生产验收或整个 Goal 已 ready_for_joint_validation。"}],"implementation_subject_commit":"d35e2cc6c25428493cc4ef347d3ee682e1de443c","review_id":"rf-33ef469d-f44e-58e0-b3fb-e81ac9a1ae97","review_phase":"final","reviewer_job_id":"33ef469d-f44e-58e0-b3fb-e81ac9a1ae97","reviewer_model":"gateway/gpt-6-astra","spec_digest":"sha256:277fc64ee56374cb35a07018c137878c7cb8ecbed2c6f39b1f2437eebff7f01a","subject_commit":"e41e6b85088beaa1c310b9a6e56c43c8ab91d3aa","verdict":"REJECT"}
