{"attempt_id":"cb18ba49-a545-5ee1-9ab4-fd68ed9523f8","contract_version":"dev-dispatch.attempt-context/v1","findings":[],"implementation_subject_commit":"6a0743c4e95acff7b2fa6b230f9827060b1bf21b","review_id":"rf-cb18ba49-a545-5ee1-9ab4-fd68ed9523f8","review_phase":"final","reviewer_job_id":"cb18ba49-a545-5ee1-9ab4-fd68ed9523f8","reviewer_model":"gateway/deepseek-v4-pro","spec_digest":"sha256:c9b0ac51e2c85bcd91664cd13b9577b2d976641d4318ab44cfffd89b26e067aa","subject_commit":"f38185fd9be01bc59d610f1b3337a1dc4d1e1261","verdict":"APPROVE"}
