{"attempt_id":"b9d31b4c-1568-528e-a2a3-1c9dd9415b6c","contract_version":"dev-dispatch.attempt-context/v1","findings":[{"location":".dev-dispatch/handoffs/b9d31b4c-1568-528e-a2a3-1c9dd9415b6c/implement.json","severity":"note","summary":"产品一致性以文件检视而非机械 diff 核对：只读工具集无法执行契约要求的 git diff 4268456 06f3c01 -- . ':(exclude).dev-dispatch'。已核：本代（generation 3）.dev-dispatch/ 下的新增物（handoffs/b9d31b4c/implement.json、按代重播为空的 feedback/index.json）全部落在保留命名空间内；所检产品文件与 handoff 验收记录自洽（tests/test_m5_release_branch_model.py 机械计数 40 个用例 == 记录 40/40；.dd-evidence/acceptance.json 记两条 dd-acceptance 命令 exit 0），未见物化提交改动产品文件的迹象。机械核验留给确定性封印对真实 Git HEAD 的独立校验。"},{"location":"src/fleet_graph/state/fleet_state.py:477-497; src/fleet_graph/cli.py:826-849,1983-2004; deploy/systemd/fleet-graph-state.service:50-51; tests/test_m5_release_branch_model.py:796-905","severity":"note","summary":"本代产品增量闭合前代记录项并超出：:7494 生产入口的 release_behind 注入完整落地——FleetStateConfig 增加 release_behind_repo/remote/threshold 字段，FleetStateView.__init__ 经 _default_release_behind_reader 自造默认 reader（未点名仓库时诚实恒 None、不碰 git），state serve 与 line-state serve 双旗标面接进 config，:7494 与 :5615 两个 systemd 单元 ExecStart 均点名 --release-behind-repo /data/apps/fleet-graph/current 与 --release-behind-remote origin；tests/test_m5_release_branch_model.py:796/:886 两个新用例分别钉死 CLI 构造与 :7494 部署单元接线。rf-ffc78633 的 blocker 自 attempt 2 起收口，本代补齐 :7494 面的测试钉子；spec 判据逐条有对应用例（三层模型、configure 首步 rebase、base 冻结、CROSS_BRANCH_BASE/MAIN_PUSH_FORBIDDEN 拒绝码、rebase 缺失红、release_behind 指标与双面部署接线），design §6.4 历史反例（160 提交死分支）写进注释与默认阈值，验收计数单调增长（2704→2706 total，M5 38→40）与零测试删除一致。"}],"implementation_subject_commit":"06f3c01ea42896d1164e80f43def82accd45554f","review_id":"rc-b9d31b4c-1568-528e-a2a3-1c9dd9415b6c","review_phase":"continuous","reviewer_job_id":"b9d31b4c-1568-528e-a2a3-1c9dd9415b6c","reviewer_model":"gateway/glm-5.3","spec_digest":"sha256:b1c3bd71ee221efaa8d328956544dc1132b40e83f70e92365dbb87e30b02357b","subject_commit":"06f3c01ea42896d1164e80f43def82accd45554f","verdict":"APPROVE"}
