{"attempt_id":"0339995d-897a-5848-ae77-f7f49bba7acd","contract_version":"dev-dispatch.attempt-context/v1","findings":[{"location":"scripts/turn-timeout-report.py:375-384","severity":"note","summary":"dd 侧 re_prepare 回填用字符串比较 ISO 时间戳(prep[\"at\"] <= at),假定 events.jsonl 内时间戳格式统一;混合格式可能错配代数。错配失败时退化为「不可得」而非编造,不阻塞。"}],"implementation_subject_commit":"3d7a026155ae9cb26ca5b030350a81d8b1783135","review_id":"rc-0339995d-897a-5848-ae77-f7f49bba7acd","review_phase":"continuous","reviewer_job_id":"0339995d-897a-5848-ae77-f7f49bba7acd","reviewer_model":"glm-5.3","spec_digest":"sha256:dea9ce7518d5d9f54940b7daa271bb706753e3a567d308eecee0d83c9b5b48f4","subject_commit":"3d7a026155ae9cb26ca5b030350a81d8b1783135","verdict":"APPROVE"}
