{"attempt_id":"ac3dd8fc-74fe-54a0-ab38-01bef92bc2d0","contract_version":"dev-dispatch.attempt-context/v1","findings":[],"implementation_subject_commit":"8455aac061be3197ae33ef6e4090c723522ad9d7","review_id":"rc-ac3dd8fc-74fe-54a0-ab38-01bef92bc2d0","review_phase":"continuous","reviewer_job_id":"ac3dd8fc-74fe-54a0-ab38-01bef92bc2d0","reviewer_model":"deepseek-v4-pro","spec_digest":"sha256:bc12338833baee85ecc8e515de3eae7f7f6f273a049b91774555e57270f193e3","subject_commit":"8455aac061be3197ae33ef6e4090c723522ad9d7","verdict":"APPROVE"}
