{"attempt_id":"b74594e5-a3c7-5c5b-b533-bdb14ecb601b","contract_version":"dev-dispatch.attempt-context/v1","findings":[],"implementation_subject_commit":"81b6052cd8e920b517debbeeb3d1b0b656c4e5e8","review_id":"rf-b74594e5-a3c7-5c5b-b533-bdb14ecb601b","review_phase":"final","reviewer_job_id":"b74594e5-a3c7-5c5b-b533-bdb14ecb601b","reviewer_model":"gateway/deepseek-v4-pro","spec_digest":"sha256:433d4887daa87742179144225950c5d148af3998e2f36d4d5b32d78c3680c69d","subject_commit":"52ddea0153295d07c987416ff163b92d0bea288f","verdict":"APPROVE"}
