{"attempt_id":"942a12b6-631b-5657-9cbb-4c47b2ced3df","contract_version":"dev-dispatch.attempt-context/v1","findings":[{"location":"src/fleet_graph/graphs/kernel_coordinator.py:118-127,259-268; src/fleet_graph/goal/request_kernel.py:658-684,735-737,1059-1074","severity":"major","summary":"An unavailable Goal-call port permanently consumes accepted requests without a Goal response. When goal_call is None, _run_call invokes finish_goal_call with a fabricated empty action list. This persists a Stop List and call_result, releases the fence, and allows turn to drain the remaining requests the same way. Reconstruction treats these requests as served, while resubmission with their stable identities is rejected as duplicate; binding the port later therefore cannot deliver the original requests. The goal_call_unwired fact is returned to the graph but is not recorded as a recoverable failed call in the kernel journal. Preserve these requests as pending and record the explicit capability failure without synthesizing a completed Goal response. Add an offline regression that accepts multiple requests with no port, reconstructs and binds a fake port, and verifies each original request is delivered once in order. This violates the request-to-call, explicit unsupported-capability, and recoverability requirements; it does not require live Runtime integration."},{"location":".dev-dispatch/feedback/index.json; .dev-dispatch/feedback/history.json; .dev-dispatch/reviews/rc-942a12b6-631b-5657-9cbb-4c47b2ced3df/review.json","severity":"note","summary":"Continuous independently recorded APPROVE for implementation subject d716f5b9c11eeed77a13a42c3105eac21136914c, with a deferred version-activation wiring note. Final independently records REJECT for the development-stage request-loss defect above. Inspected source and regression tests address the prior Final findings concerning newline-less journal tails, outstanding NOT_READY deliveries, mid-list version activation, and interrupted raw-response preservation. Some historical review JSON lines and the archive were truncated by the inspection tools, so complete historical artifact verification is not claimed."},{"location":".dev-dispatch/handoffs/942a12b6-631b-5657-9cbb-4c47b2ced3df/implement.json","severity":"note","summary":"The supplied input_commit and subject_commit are the identical full RC identity 5cce8b6a78fa1e75895863c32a3d3f428068bfe8. The inspected worktree HEAD reflog records the product commit 727672f3bc6d30cb0cd3bb683aa2bbb2a01b31dc advancing to implementation handoff d716f5b9c11eeed77a13a42c3105eac21136914c and then to that RC identity, consistent with implement.json and the Continuous index. Reflog inspection does not establish product-tree equality or actual current HEAD. No shell or Git command was executed, and the requested exclusion diff was not mechanically verified with the available file-inspection tools. Actual HEAD verification remains with the deterministic seal; no product mismatch is asserted merely because the SHAs differ."},{"location":".dev-dispatch/handoffs/942a12b6-631b-5657-9cbb-4c47b2ced3df/implement.json; .dev-dispatch/spec/approved.md:65-69","severity":"note","summary":"The committed implementation handoff reports compileall exit 0 and 56 focused kernel tests passing; these are reported evidence, not checks executed by Final. Real Runtime invocation, actual reply delivery, process stop/resume and crash adoption, full Session queries, merge reconciliation, multi-repo finalization, and joint E2E remain unrun and deferred under the experiment constraints. This review does not claim production acceptance or ready_for_joint_validation for the entire Goal."}],"implementation_subject_commit":"d716f5b9c11eeed77a13a42c3105eac21136914c","review_id":"rf-942a12b6-631b-5657-9cbb-4c47b2ced3df","review_phase":"final","reviewer_job_id":"942a12b6-631b-5657-9cbb-4c47b2ced3df","reviewer_model":"gateway/gpt-6-astra","spec_digest":"sha256:277fc64ee56374cb35a07018c137878c7cb8ecbed2c6f39b1f2437eebff7f01a","subject_commit":"5cce8b6a78fa1e75895863c32a3d3f428068bfe8","verdict":"REJECT"}
