{"attempt_id":"533b6818-7a4c-54ca-83f1-58632bf84b21","contract_version":"dev-dispatch.attempt-context/v1","findings":[{"location":"src/fleet_graph/dd/control_plane.py:1076-1092","severity":"note","summary":"DdControlPlane._launch records the launch entry only after launcher.launch() returns, so a SIGKILL in that narrow window leaves the O_EXCL claim with no mode:\"resume\" entry. The replay recomputes seq = len(launches)+1 to the same value and therefore the same unit name, so systemd-run refuses the still-active unit, _launch raises LAUNCH_FAILED, and the bridge seals a terminal `refused` receipt for a recovery that is in fact running. No double recovery and no lost recovery in this path -- the mirror image of the attempt-2 receipt-fidelity finding, and narrower. Only if the bridge stays down long enough for the resume unit to finish and be --collect'ed does the freed unit name allow a genuine second launch."},{"location":"src/fleet_graph/decision_bridge/resolver.py:147-154","severity":"note","summary":"An owner-discovery failure is sealed as a terminal no_waiting_owner no-op and advances the cursor, whereas a bus read failure returns without advancing and retries next cycle. DdOwnerSource.discover now raises (attempt-1's finding: the distinction is preserved in the receipt reason), but the category stays terminal, so a decision arriving during a transient dd control-plane outage is never revisited by the bridge and forfeits the <5s path to the spec-mandated 60s GateAutoResumer. Deliberate and pinned by test_a_discovery_failure_is_a_structured_noop; recorded as an asymmetry with the loop's own fail-closed-and-retry posture, not as a spec violation."},{"location":".dev-dispatch/handoffs/533b6818-7a4c-54ca-83f1-58632bf84b21/implement.json","severity":"note","summary":"The committed implement handoff records work_head_commit as 599dddaf1759a64692d902532607f1fbbb84865f, while the dispatch context for this review states the product commit (work_head_commit) is 25c2163df61641428b60b9dfbe60e637f189d517 -- the same SHA it gives for implementation_subject_commit. The identical inconsistency was flagged by the attempt-1 and attempt-2 final reviews and is unresolved. Flagged for the Engine to reconcile; it does not affect the verdict, which rests on the spec conformance of the tree as read."},{"location":".dev-dispatch/","severity":"note","summary":"Disclosure, not a defect claim: the mechanical product-equality check between 25c2163d and 9f0f23f9 (git diff --exit-code excluding .dev-dispatch) was NOT executed -- this reviewer has only read-only file inspection, and shell access in this session is confined to the run workdir and cannot reach the worktree. No claim is made in either direction about whether the review materialization was metadata-only; the review covers the worktree tree contents as read at /data/worktrees/fleet-graph-e1-extension-fresh-20260828. The APPROVE rests on the spec conformance of that tree."}],"implementation_subject_commit":"25c2163df61641428b60b9dfbe60e637f189d517","review_id":"rf-533b6818-7a4c-54ca-83f1-58632bf84b21","review_phase":"final","reviewer_job_id":"533b6818-7a4c-54ca-83f1-58632bf84b21","reviewer_model":"claude-opus-5[1m]","spec_digest":"sha256:4dd1b522e9721c45562bb6380c646702d33da57239f5a9afe25a5a7a74abfc6c","subject_commit":"9f0f23f97c7a67f14371f31bcc07fb931ae231b0","verdict":"APPROVE"}
