{"attempt_id":"257789d1-7dc9-5330-beb6-9a6d2304d675","contract_version":"dev-dispatch.attempt-context/v1","findings":[],"implementation_subject_commit":"1eb5496a12dc4b04ab77a9eac60987b5f21472ab","review_id":"rc-257789d1-7dc9-5330-beb6-9a6d2304d675","review_phase":"continuous","reviewer_job_id":"257789d1-7dc9-5330-beb6-9a6d2304d675","reviewer_model":"gateway/deepseek-v4-pro","spec_digest":"sha256:046aced0f9d718dd18dd974ee3e96b4e5a79b376eea149d2706259d7f4083acd","subject_commit":"1eb5496a12dc4b04ab77a9eac60987b5f21472ab","verdict":"APPROVE"}
