{"attempt_id":"69ef305d-d117-5e75-a84e-0fd1a5b530de","contract_version":"dev-dispatch.attempt-context/v1","findings":[],"implementation_subject_commit":"1648e320f528f75ce86892b586ecec0af1ce0d0d","review_id":"rc-69ef305d-d117-5e75-a84e-0fd1a5b530de","review_phase":"continuous","reviewer_job_id":"69ef305d-d117-5e75-a84e-0fd1a5b530de","reviewer_model":"deepseek-v4-pro","spec_digest":"sha256:3ae16b853215b15d5386f6a6444876a4d7dc2961603686a0c855aaabd4e099b8","subject_commit":"1648e320f528f75ce86892b586ecec0af1ce0d0d","verdict":"APPROVE"}
