{"attempt_id":"62eab45e-4a77-5f84-8395-93dcabc836eb","contract_version":"dev-dispatch.attempt-context/v1","findings":[],"implementation_subject_commit":"fa515e86f6c6ed0ad6c607df41f192f867223ea8","review_id":"rf-62eab45e-4a77-5f84-8395-93dcabc836eb","review_phase":"final","reviewer_job_id":"62eab45e-4a77-5f84-8395-93dcabc836eb","reviewer_model":"deepseek-v4-pro","spec_digest":"sha256:dc54a9f3b7edc3719c9dd0b5d71581bd9d1d84c1f822b73f29fa1174a9b7486a","subject_commit":"ed573b88d1638e80c33aa5d3e9176577df2c751d","verdict":"APPROVE"}
